[
  {
    "hpi_type": "traditional",
    "hpi_flavor": "purchase-only",
    "frequency": "monthly",
    "level": "USA or Census Division",
    "place_name": "East North Central Division",
    "place_id": "DV_ENC",
    "yr": 1991,
    "period": 1,
    "index_nsa": 100.0,
    "index_sa": 100.0,
    "rstderr": null,
    "note": ""
  },
  {
    "hpi_type": "traditional",
    "hpi_flavor": "all-transactions",
    "frequency": "quarterly",
    "level": "MSA",
    "place_name": "Abilene, TX",
    "place_id": "10180",
    "yr": 1986,
    "period": 2,
    "index_nsa": 108.13,
    "index_sa": null,
    "rstderr": null,
    "note": ""
  },
  {
    "hpi_type": "traditional",
    "hpi_flavor": "all-transactions",
    "frequency": "quarterly",
    "level": "State",
    "place_name": "Alaska",
    "place_id": "AK",
    "yr": 1975,
    "period": 1,
    "index_nsa": 69.15,
    "index_sa": null,
    "rstderr": null,
    "note": ""
  },
  {
    "hpi_type": "traditional",
    "hpi_flavor": "all-transactions",
    "frequency": "quarterly",
    "level": "USA or Census Division",
    "place_name": "East North Central Division",
    "place_id": "DV_ENC",
    "yr": 1975,
    "period": 1,
    "index_nsa": 63.57,
    "index_sa": null,
    "rstderr": null,
    "note": ""
  },
  {
    "hpi_type": "traditional",
    "hpi_flavor": "expanded-data",
    "frequency": "quarterly",
    "level": "MSA",
    "place_name": "Abilene, TX",
    "place_id": "10180",
    "yr": 1991,
    "period": 1,
    "index_nsa": 100.0,
    "index_sa": 100.0,
    "rstderr": 0.0,
    "note": "Note: Fewer than 1,000 repeat-sales records have accumulated up to this quarter"
  },
  {
    "hpi_type": "traditional",
    "hpi_flavor": "expanded-data",
    "frequency": "quarterly",
    "level": "State",
    "place_name": "Alaska",
    "place_id": "AK",
    "yr": 1991,
    "period": 1,
    "index_nsa": 100.0,
    "index_sa": 100.0,
    "rstderr": null,
    "note": ""
  },
  {
    "hpi_type": "traditional",
    "hpi_flavor": "expanded-data",
    "frequency": "quarterly",
    "level": "USA or Census Division",
    "place_name": "East North Central Division",
    "place_id": "DV_ENC",
    "yr": 1991,
    "period": 1,
    "index_nsa": 100.0,
    "index_sa": 100.0,
    "rstderr": null,
    "note": ""
  },
  {
    "hpi_type": "traditional",
    "hpi_flavor": "purchase-only",
    "frequency": "quarterly",
    "level": "MSA",
    "place_name": "Albany-Schenectady-Troy, NY",
    "place_id": "10580",
    "yr": 1991,
    "period": 1,
    "index_nsa": 100.0,
    "index_sa": 100.0,
    "rstderr": null,
    "note": ""
  },
  {
    "hpi_type": "traditional",
    "hpi_flavor": "purchase-only",
    "frequency": "quarterly",
    "level": "State",
    "place_name": "Alaska",
    "place_id": "AK",
    "yr": 1991,
    "period": 1,
    "index_nsa": 100.0,
    "index_sa": 100.0,
    "rstderr": null,
    "note": ""
  },
  {
    "hpi_type": "traditional",
    "hpi_flavor": "purchase-only",
    "frequency": "quarterly",
    "level": "USA or Census Division",
    "place_name": "East North Central Division",
    "place_id": "DV_ENC",
    "yr": 1991,
    "period": 1,
    "index_nsa": 100.0,
    "index_sa": 100.0,
    "rstderr": null,
    "note": ""
  },
  {
    "hpi_type": "non-metro",
    "hpi_flavor": "all-transactions",
    "frequency": "quarterly",
    "level": "State",
    "place_name": "Alaska",
    "place_id": "AK",
    "yr": 1995,
    "period": 1,
    "index_nsa": 100.0,
    "index_sa": null,
    "rstderr": null,
    "note": ""
  },
  {
    "hpi_type": "manufactured",
    "hpi_flavor": "all-transactions",
    "frequency": "quarterly",
    "level": "USA or Census Division",
    "place_name": "United States",
    "place_id": "USA",
    "yr": 2000,
    "period": 1,
    "index_nsa": 100.0,
    "index_sa": null,
    "rstderr": null,
    "note": ""
  },
  {
    "hpi_type": "manufactured",
    "hpi_flavor": "purchase-only",
    "frequency": "quarterly",
    "level": "USA or Census Division",
    "place_name": "United States",
    "place_id": "USA",
    "yr": 2000,
    "period": 1,
    "index_nsa": 100.0,
    "index_sa": null,
    "rstderr": null,
    "note": ""
  },
  {
    "hpi_type": "distress-free",
    "hpi_flavor": "purchase-only",
    "frequency": "quarterly",
    "level": "MSA",
    "place_name": "Anaheim-Santa Ana-Irvine, CA (MSAD)",
    "place_id": "11244",
    "yr": 1991,
    "period": 1,
    "index_nsa": 100.0,
    "index_sa": 100.0,
    "rstderr": null,
    "note": ""
  },
  {
    "hpi_type": "developmental",
    "hpi_flavor": "all-transactions",
    "frequency": "quarterly",
    "level": "Puerto Rico",
    "place_name": "Puerto Rico",
    "place_id": "PR",
    "yr": 1995,
    "period": 2,
    "index_nsa": 103.72,
    "index_sa": null,
    "rstderr": null,
    "note": ""
  },
  {
    "hpi_type": "developmental",
    "hpi_flavor": "purchase-only",
    "frequency": "quarterly",
    "level": "Puerto Rico",
    "place_name": "Puerto Rico",
    "place_id": "PR",
    "yr": 1996,
    "period": 1,
    "index_nsa": 106.64,
    "index_sa": 106.87,
    "rstderr": null,
    "note": ""
  }
]